{
  "contract": "wwcx.outbound-mail-controlled-pilot-evidence.v1",
  "captured_at": null,
  "execution_status": "not_executed",
  "pilot_id": "WWCX-MAIL-PILOT-UNEXECUTED",
  "scope": {
    "provider_profile": null,
    "provider_family": null,
    "sender_address": null,
    "sender_domain": null,
    "recipient_address_sha256": null,
    "recipient_domain": null,
    "recipient_owned_by_wwcx": false,
    "message_class": "not_selected",
    "subject_sha256": null,
    "body_sha256": null,
    "message_count": 0,
    "recipient_count": 0
  },
  "authorizations": {
    "provider_terms_reviewed": false,
    "provider_credential_installation_authorized": false,
    "sender_activation_authorized": false,
    "runtime_cutover_authorized": false,
    "exact_recipient_authorized": false,
    "exact_message_authorized": false,
    "production_message_traffic_authorized": false,
    "authorization_reference": null
  },
  "preflight": {
    "repository_commit": null,
    "clean_main": false,
    "gateway_enabled": false,
    "deployment_authorized": false,
    "external_delivery_authorized": false,
    "send_endpoint_enabled": false,
    "policy_enabled": false,
    "smtp_cutover_authorized": false,
    "provider_selected": false,
    "provider_ready": false,
    "sender_allowlisted": false,
    "canonical_sender_provider_object_verified": false,
    "spf_path_verified": false,
    "dkim_dns_verified": false,
    "dmarc_record_published": false,
    "return_path_defined": false,
    "bounce_ingestion_ready": false,
    "complaint_suppression_ready": false,
    "rollback_verified": false
  },
  "submission": {
    "attempted": false,
    "accepted_by_provider": false,
    "provider_message_id_sha256": null,
    "gateway_http_status": null,
    "provider_response_class": "not_attempted",
    "submitted_at": null
  },
  "receipt": {
    "received": false,
    "received_at": null,
    "recipient_address_sha256": null,
    "message_id_sha256": null,
    "subject_hash_matches": false,
    "body_hash_matches": false,
    "controlled_footer_present": false,
    "control_headers_present": false,
    "complete_headers_evidence_sha256": null
  },
  "authentication": {
    "dkim_result": "not_tested",
    "dkim_selector": null,
    "dkim_signing_domain": null,
    "dkim_from_alignment": false,
    "spf_result": "not_tested",
    "spf_envelope_domain": null,
    "spf_from_alignment": false,
    "dmarc_result": "not_tested",
    "dmarc_policy": "not_observed",
    "dmarc_aligned": false
  },
  "audit_linkage": {
    "control_id": null,
    "gateway_event_id": null,
    "gateway_audit_record_sha256": null,
    "provider_message_id_matches": false,
    "receipt_message_id_matches": false,
    "recipient_hash_matches": false
  },
  "rollback": {
    "plan_reference": null,
    "available": false,
    "executed": false,
    "reason": null,
    "post_rollback_safe_disabled": false,
    "evidence_sha256": null
  },
  "safety": {
    "single_message_only": true,
    "single_recipient_only": true,
    "bulk_traffic_enabled": false,
    "commercial_traffic_enabled": false,
    "customer_traffic_enabled": false,
    "regulatory_traffic_enabled": false,
    "emergency_traffic_enabled": false,
    "provider_credentials_inspected_by_validator": false,
    "message_body_stored_inline": false,
    "recipient_address_stored_inline": false,
    "complete_headers_stored_inline": false,
    "message_sent": false
  },
  "evidence_files": [],
  "failure_reasons": []
}
